[
  {
    "knowledge_id": "K-CATHAY-DCA-001",
    "title": "台股定期定額的基本概念",
    "standard_answer": "台股定期定額是依預先約定的日期與金額，定期買進台股或 ETF 的方式。實際成交價格與股數會依券商執行及分配結果而定。",
    "source_id": "SRC-CATHAY-DCA-001",
    "source_uri": "https://istockapp.cathaysec.com.tw/Marketing/DCA/",
    "source_locator": "常見問題：什麼是台股定期定額",
    "source_type": "official_web",
    "products": ["台股定期定額"],
    "platforms": ["web"],
    "app_versions": [],
    "effective_at": null,
    "expires_at": null,
    "review_at": null,
    "owner_unit": null,
    "author": "Codex-assisted draft import",
    "reviewer": null,
    "approver": null,
    "approved_at": null,
    "version": "0.1-draft",
    "change_summary": "由官方行銷頁面整理的初始草稿",
    "previous_version": null,
    "status": "draft",
    "public_answer_allowed": false,
    "allowed_intents": ["general_securities_knowledge"],
    "prohibited_extensions": ["不得延伸為個人化投資建議", "不得代替使用者執行申購或交易"]
  },
  {
    "knowledge_id": "K-CATHAY-DCA-002",
    "title": "台股定期定額約定日遇休市",
    "standard_answer": "台股定期定額的約定買進日若遇市場休市，會順延至下一個交易日；如果當月沒有約定的日期，該日期不會執行委託。",
    "source_id": "SRC-CATHAY-DCA-001",
    "source_uri": "https://istockapp.cathaysec.com.tw/Marketing/DCA/",
    "source_locator": "台股常見問題：申購日遇假日與月份無指定日期",
    "source_type": "official_web",
    "products": ["台股定期定額"],
    "platforms": ["web"],
    "app_versions": [],
    "effective_at": null,
    "expires_at": null,
    "review_at": null,
    "owner_unit": null,
    "author": "Codex-assisted draft import",
    "reviewer": null,
    "approver": null,
    "approved_at": null,
    "version": "0.1-draft",
    "change_summary": "由官方行銷頁面整理的初始草稿",
    "previous_version": null,
    "status": "draft",
    "public_answer_allowed": false,
    "allowed_intents": ["general_securities_knowledge"],
    "prohibited_extensions": ["不得查詢個人申購狀態", "不得保證實際成交結果"]
  },
  {
    "knowledge_id": "K-CATHAY-DCA-003",
    "title": "美股定期投資的兩種方式",
    "standard_answer": "美股定期投資包含固定金額的定期定額，以及固定股數的定期定股，可用於符合服務範圍的美股、ETF 或特別股。實際可選日期與標的應以最新官方頁面為準。",
    "source_id": "SRC-CATHAY-DCA-001",
    "source_uri": "https://istockapp.cathaysec.com.tw/Marketing/DCA/",
    "source_locator": "美股常見問題：什麼是美股定期投資",
    "source_type": "official_web",
    "products": ["美股定期投資"],
    "platforms": ["web"],
    "app_versions": [],
    "effective_at": null,
    "expires_at": null,
    "review_at": null,
    "owner_unit": null,
    "author": "Codex-assisted draft import",
    "reviewer": null,
    "approver": null,
    "approved_at": null,
    "version": "0.1-draft",
    "change_summary": "由官方行銷頁面整理的初始草稿",
    "previous_version": null,
    "status": "draft",
    "public_answer_allowed": false,
    "allowed_intents": ["general_securities_knowledge"],
    "prohibited_extensions": ["不得推薦特定美股或 ETF", "不得代替使用者執行申購或交易"]
  },
  {
    "knowledge_id": "K-CATHAY-US-001",
    "title": "申請美股交易帳戶的一般流程",
    "standard_answer": "美股交易需要先完成複委託帳戶開立。官方頁面提供透過國泰世華 CUBE App 申請或加開複委託帳戶的方式；實際資格與流程應以最新官方說明為準。",
    "source_id": "SRC-CATHAY-USSTOCK-001",
    "source_uri": "https://istockapp.cathaysec.com.tw/Marketing/usstock",
    "source_locator": "常見問題：美股開戶與加開複委託帳戶",
    "source_type": "official_web",
    "products": ["美股複委託"],
    "platforms": ["web"],
    "app_versions": [],
    "effective_at": null,
    "expires_at": null,
    "review_at": null,
    "owner_unit": null,
    "author": "Codex-assisted draft import",
    "reviewer": null,
    "approver": null,
    "approved_at": null,
    "version": "0.1-draft",
    "change_summary": "由官方行銷頁面整理的初始草稿",
    "previous_version": null,
    "status": "draft",
    "public_answer_allowed": false,
    "allowed_intents": ["account_opening_general"],
    "prohibited_extensions": ["不得查詢個人開戶狀態", "不得接收身分資料或帳號密碼"]
  },
  {
    "knowledge_id": "K-CATHAY-US-002",
    "title": "美股交割幣別的一般說明",
    "standard_answer": "複委託帳戶可依官方申請流程選擇台幣或外幣扣款。台幣扣款著重便利性，外幣扣款可自行管理換匯時點與匯率成本；實際可用幣別以帳戶設定及最新官方規則為準。",
    "source_id": "SRC-CATHAY-USSTOCK-001",
    "source_uri": "https://istockapp.cathaysec.com.tw/Marketing/usstock",
    "source_locator": "常見問題：美股交易可用幣別",
    "source_type": "official_web",
    "products": ["美股複委託"],
    "platforms": ["web"],
    "app_versions": [],
    "effective_at": null,
    "expires_at": null,
    "review_at": null,
    "owner_unit": null,
    "author": "Codex-assisted draft import",
    "reviewer": null,
    "approver": null,
    "approved_at": null,
    "version": "0.1-draft",
    "change_summary": "由官方行銷頁面整理的初始草稿",
    "previous_version": null,
    "status": "draft",
    "public_answer_allowed": false,
    "allowed_intents": ["general_securities_knowledge"],
    "prohibited_extensions": ["不得提供個人化換匯建議", "不得查詢個人交割帳戶"]
  },
  {
    "knowledge_id": "K-CATHAY-US-003",
    "title": "美股一般交易時段",
    "standard_answer": "官方頁面列示，美股交易時間會因夏令與冬令時間不同而改變。回答時應說明這是台灣時間的概略區間，並提醒以當日市場與官方公告為準。",
    "source_id": "SRC-CATHAY-USSTOCK-001",
    "source_uri": "https://istockapp.cathaysec.com.tw/Marketing/usstock",
    "source_locator": "常見問題：美股交易時間",
    "source_type": "official_web",
    "products": ["美股複委託"],
    "platforms": ["web"],
    "app_versions": [],
    "effective_at": null,
    "expires_at": null,
    "review_at": null,
    "owner_unit": null,
    "author": "Codex-assisted draft import",
    "reviewer": null,
    "approver": null,
    "approved_at": null,
    "version": "0.1-draft",
    "change_summary": "由官方行銷頁面整理的初始草稿",
    "previous_version": null,
    "status": "draft",
    "public_answer_allowed": false,
    "allowed_intents": ["public_service_information"],
    "prohibited_extensions": ["不得推測特定日期是否開市", "不得據此提供買賣時點建議"]
  },
  {
    "knowledge_id": "K-CATHAY-US-004",
    "title": "美股買賣交割時程的一般說明",
    "standard_answer": "官方頁面說明，美股買進交割為 T+1，賣出款項則依頁面所列時程處理；複委託採圈存交易，下單前需要準備足夠款項。實際日期仍應以最新官方公告與交易日曆為準。",
    "source_id": "SRC-CATHAY-USSTOCK-001",
    "source_uri": "https://istockapp.cathaysec.com.tw/Marketing/usstock",
    "source_locator": "常見問題：美股下單後扣款與交割",
    "source_type": "official_web",
    "products": ["美股複委託"],
    "platforms": ["web"],
    "app_versions": [],
    "effective_at": null,
    "expires_at": null,
    "review_at": null,
    "owner_unit": null,
    "author": "Codex-assisted draft import",
    "reviewer": null,
    "approver": null,
    "approved_at": null,
    "version": "0.1-draft",
    "change_summary": "由官方行銷頁面整理的初始草稿",
    "previous_version": null,
    "status": "draft",
    "public_answer_allowed": false,
    "allowed_intents": ["general_securities_knowledge"],
    "prohibited_extensions": ["不得查詢個人扣款或成交狀態", "不得保證特定日期完成交割"]
  },
  {
    "knowledge_id": "K-CATHAY-NEWBIE-001",
    "title": "證券帳戶與銀行交割帳戶的差別",
    "standard_answer": "證券帳戶主要記錄股票買賣、申購與持有資料；銀行交割帳戶則用來處理交易款項。這是一般概念說明，不代表系統可以查詢任何個人帳戶。",
    "source_id": "SRC-CATHAY-NEWBIE-001",
    "source_uri": "https://istockapp.cathaysec.com.tw/Marketing/TipsForNew/",
    "source_locator": "投資三大心法：搞懂交割戶",
    "source_type": "official_web",
    "products": ["台股", "美股複委託"],
    "platforms": ["web"],
    "app_versions": [],
    "effective_at": null,
    "expires_at": null,
    "review_at": null,
    "owner_unit": null,
    "author": "Codex-assisted draft import",
    "reviewer": null,
    "approver": null,
    "approved_at": null,
    "version": "0.1-draft",
    "change_summary": "由官方行銷頁面整理的初始草稿",
    "previous_version": null,
    "status": "draft",
    "public_answer_allowed": false,
    "allowed_intents": ["general_securities_knowledge"],
    "prohibited_extensions": ["不得查詢餘額、庫存或交割款", "不得要求使用者提供帳號"]
  },
  {
    "knowledge_id": "K-CATHAY-NEWBIE-002",
    "title": "台股交割款準備期限的一般說明",
    "standard_answer": "官方新手頁面提醒，台股成交後需在交割期限前把足額款項存入銀行交割帳戶，避免發生違約交割。確切期限與責任應以最新官方及法規說明為準。",
    "source_id": "SRC-CATHAY-NEWBIE-001",
    "source_uri": "https://istockapp.cathaysec.com.tw/Marketing/TipsForNew/",
    "source_locator": "投資三大心法：存錢期限",
    "source_type": "official_web",
    "products": ["台股"],
    "platforms": ["web"],
    "app_versions": [],
    "effective_at": null,
    "expires_at": null,
    "review_at": null,
    "owner_unit": null,
    "author": "Codex-assisted draft import",
    "reviewer": null,
    "approver": null,
    "approved_at": null,
    "version": "0.1-draft",
    "change_summary": "由官方行銷頁面整理的初始草稿",
    "previous_version": null,
    "status": "draft",
    "public_answer_allowed": false,
    "allowed_intents": ["general_securities_knowledge"],
    "prohibited_extensions": ["不得查詢個人交割款", "不得提供法律責任判斷"]
  },
  {
    "knowledge_id": "K-CATHAY-DRIP-001",
    "title": "股息再投資的基本概念",
    "standard_answer": "股息再投資是把符合條件標的的現金股息，依官方規則再投入買進同一標的。實際計算基礎、日期與是否執行，應以最新官方規則為準。",
    "source_id": "SRC-CATHAY-DRIP-001",
    "source_uri": "https://istockapp.cathaysec.com.tw/Marketing/drip/",
    "source_locator": "常見問題：什麼是股息再投資",
    "source_type": "official_web",
    "products": ["台股股息再投資"],
    "platforms": ["web"],
    "app_versions": [],
    "effective_at": null,
    "expires_at": null,
    "review_at": null,
    "owner_unit": null,
    "author": "Codex-assisted draft import",
    "reviewer": null,
    "approver": null,
    "approved_at": null,
    "version": "0.1-draft",
    "change_summary": "由官方行銷頁面整理的初始草稿",
    "previous_version": null,
    "status": "draft",
    "public_answer_allowed": false,
    "allowed_intents": ["general_securities_knowledge"],
    "prohibited_extensions": ["不得描述歷史績效為未來報酬保證", "不得推薦特定標的"]
  },
  {
    "knowledge_id": "K-CATHAY-DRIP-002",
    "title": "股息再投資的一般申請資格",
    "standard_answer": "官方頁面列示，申請人需符合國泰證券的客戶資格，並已有台股定期定額申購單；可申請標的以當時官方公告的台股與 ETF 範圍為準。",
    "source_id": "SRC-CATHAY-DRIP-001",
    "source_uri": "https://istockapp.cathaysec.com.tw/Marketing/drip/",
    "source_locator": "常見問題：申請資格與可申請標的",
    "source_type": "official_web",
    "products": ["台股股息再投資"],
    "platforms": ["web"],
    "app_versions": [],
    "effective_at": null,
    "expires_at": null,
    "review_at": null,
    "owner_unit": null,
    "author": "Codex-assisted draft import",
    "reviewer": null,
    "approver": null,
    "approved_at": null,
    "version": "0.1-draft",
    "change_summary": "由官方行銷頁面整理的初始草稿",
    "previous_version": null,